"publisher","imprint","work_type","work_status","title","subtitle","edition","doi","reference","publication_date","publication_place","license","copyright_holder","landing_page","page_count","page_breakdown","first_page","last_page","page_interval","image_count","table_count","audio_count","video_count","lccn","oclc","short_abstract","long_abstract","general_note","bibliography_note","toc","cover_url","cover_caption","contributions [(type, first_name, last_name, full_name, is_main, biography, orcid, website, [(position, institution, institution_doi, ror, country)])]","publications [(type, isbn, width (mm), width (cm), width (in), height (mm), height (cm), height (in), depth (mm), depth (cm), depth (in), weight (g), weight (oz), [(ISO_4217_currency, price)], [(landing_page, full_text, platform, is_canonical)])]","series [(type, name, issn_print, issn_digital, url, cfp_url, description, issue)]","languages [(relation, ISO_639-3/B_language, is_main)]","BIC [code]","THEMA [code]","BISAC [code]","LCC [code]","custom_categories [category]","keywords [keyword]","funding [(institution, institution_doi, ror, country, program, project, grant, jurisdiction)]","relations [(related_work, doi, relation_type, relation_number)]","references [(doi, citation, issn, isbn, journal_title, article_title, series_title, volume_title, edition, author, volume, issue, first_page, component_number, standard_designator, standards_body, publication_date, retrieval_date)]"
"LIBER Citizen Science Working Group","LIBER Citizen Science Working Group","TEXTBOOK","ACTIVE","Library Infrastructures & Citizen Science","A Guide","1","10.25815/tz0x-m353","CS2","2023-05-20","Odense","https://creativecommons.org/licenses/by-sa/4.0/","The Authors","https://cs4rl.github.io/infrastructure/","48","","","","","19","","","","","","Welcome to Library Infrastructures and Citizen Science the second section of the guide series Citizen Science for Research Libraries. The aim of the publication is to inspire researcher and the library community.","Welcome to Library Infrastructures and Citizen Science the second section of the guide series Citizen Science for Research Libraries. The aim of the publication is to inspire researcher and the library community to take a creative approach and take a second look at the infrastructures around them and how they can be applied to citizen science projects. Open science has already expanded the array of tools and practices used by research infrastructure. The challenge is how to take these one step further for citizen science, for example - expanding roles for acknowledgement, in collecting data, or providing pathways for the use of open access by the public.

The section editor of Research Infrastructures and Citizen Science, Kirsty Wallis of UCL Library, has brought together voices from across the research infrastructure community to show off existing facilities who are looking to support citizen science, combined with a range of case studies that have implemented citizen science research projects.

The guide series is brought to you by the LIBER Citizen Science Working Group and is part of the groups work to help share knowledge and facilitate academic libraries in their support of scholars managing citizen science research projects. As the maintainer of research infrastructures, like - repositories, persistent identifiers, collections, etc - libraries also help develop and disseminate methods and know-how. To this end the guide is a complement to the other stands of the working groups activities in advocacy, knowledge sharing, and partnerships.

The guide is designed to be a practical toolbox to help run a citizen science project. It has been put together from contributions by members of the research library community. The guide is part of a themed series of four sections - skills, infrastructures, good (open) practice, and programme development - based on the LIBER Open Science Roadmap .","","","About the Book 6
Foreword 7
Introduction: Existing Infrastructures That Can be Used to Support Citizen Science 8
Repositories and CORE: Enabling Open Science Infrastructure for All 9
Citizen Science Project and Data Descriptions 13
Effective Research Data Management 15
Social Media in Libraries and Their Use in Supporting Research 17
Persistent Identifiers and Rich Metadata 19
Case Studies Introducti on - Citizen Science and Infrastructures in Practice 21
Making a Custom Citizen Science Reader 22
Measure Together: Infrastructure Combining Environmental Citizen Science and Official Data in the Netherlands 26
Soft ware Citation Needed - Infrastructure Remixing 31
Library Space Technology Network 35
Galleries, Libraries & Museums (GLAM): Crowdsourcing in Cultural Heritage 40","https://raw.githubusercontent.com/cs4rl/infrastructure/main/cover/cover.jpg","Cover image: European Space Agency (ESA), ASAR global monitoring Mode of the Antarctic. The material is ESA copyright and is supplied to you free of charge on the following terms and conditions. Find out more about Envisat here.","[(""EDITOR"", ""Kirsty"", ""Wallis"", ""Kirsty Wallis"", ""true"", """", ""0000-0002-9570-6174"", """", [("""", ""University College London"", ""10.13039/501100000765"", ""02jx3x895"", ""GBR"")]),(""EDITOR"", ""Simon"", ""Worthington"", ""Simon Worthington"", ""true"", """", ""0000-0002-8579-9717"", ""https://mrchristian.github.io/"", [("""", ""TIB – Leibniz Information Centre for Science and Technology"", """", ""04aj4c181"", ""DEU"")]),(""EDITOR"", ""Kaarsted"", ""Kaarsted"", ""Thomas Kaarsted"", ""true"", """", ""0000-0001-6796-5753"", """", [("""", ""Southern Denmark University"", """", ""03yrrjy16"", ""DNK"")])]","[(""PAPERBACK"", ""978-87-94233-57-6"", ""210"", ""21"", ""8.27"", ""297"", ""29.7"", ""11.69"", ""31"", ""3.1"", ""1.22"", ""182"", ""6.4199"", , ),(""EPUB"", ""978-87-94233-58-3"", """", """", """", """", """", """", """", """", """", """", """", , )]","","[(""ORIGINAL"", ""ENG"", ""true"")]","","","","","","[""citizen science"",""LIBER"",""open science"",""research library""]","","",""
